<?xml-stylesheet href="../etc/plml_bo-2.2.css" type="text/css"?>
<pattern patternID="6" xsi:noNamespaceSchemaLocation="../xsd/plml-bo-2.2.xsd" xmlns:xsi="http://www.w3.org/2001/XMLSchema-instance">
    <name>Multiple Viewpoints</name>
    <name-DE>Mehrere Ansichtspunkte</name-DE>
    <problem>TODO engl. description</problem>
    <problem-DE>
        Durch die Augen des Avatars sind der virtuelle Raum und sich darin aufhaltenden Avatare schwer
        in ihrer GÃ¤nze zu erfassen.    
    </problem-DE>
    <solution>
        TODO
    </solution>
    <confidence>Idea</confidence>
    <formalization language="(none)">
        <participant identifier="viewpoint" type="Camera"/>
        <participant identifier="egoView" type="Camera"/>
        <participant identifier="roomView" type="Camera"/>
        <participant identifier="overviewMap" type="UIElement"/>
    </formalization>
</pattern>