<?xml-stylesheet href="../etc/plml_bo-2.2.css" type="text/css"?>
<pattern patternID="4" xsi:noNamespaceSchemaLocation="../xsd/plml-bo-2.2.xsd" xmlns:xsi="http://www.w3.org/2001/XMLSchema-instance">
  <name>Visible Speaker</name>
  <name-DE>Sichtbarer Sprecher</name-DE>
  <problem>TODO engl. description</problem>
  <problem-DE>
    Im Regelfall ist es erforderlich, dass eine Wortmeldung (z. B. ein natürlichsprachliches 
    Sprechen) dem jeweils sprechenden Avatar zugeordenbar ist. In Gesprächsgruppen mitm mehr als zwei 
    Teilnehmer:innen mag eine die Möglichkeit der Lippenbewegung eines sprechenden Avatars implementiert
    sein, und auch möglicherweise vorhandene 3D-Sound-Funktionen können die Sprecherortung unterstützen; 
    im Regelfall reicht dies jedoch auf Grund der schlechten Wahrnehmbarkeit nicht aus.     
  </problem-DE>
  <solution>
    TODO
  </solution>
  <confidence>Idea</confidence>
  <formalization language="(none)">
    <participant identifier="avatar" type="Avatar"/>
    <participant identifier="isTalking" type="Boolean"/>
    <participant identifier="visualization" type="Animation"/>
  </formalization>
</pattern>