<?xml-stylesheet href="../etc/plml_bo-2.2.css" type="text/css"?>
<pattern patternID="9" xsi:noNamespaceSchemaLocation="../xsd/plml-bo-2.2.xsd" xmlns:xsi="http://www.w3.org/2001/XMLSchema-instance">
  <name>Document Delivery</name>
  <name-DE>Dokumentenübergabe</name-DE>
  <problem>TODO engl. description</problem>
  <problem-DE>
    Der Studierende möchte Information aus dem virtuellen Lehrraum zum Zweck der Nachbereitung außerhalb
    der virtuellen Welt nutzen. Wie bekommt er Information aus dem Raum heraus?
  </problem-DE>
  <solution>
    TODO
  </solution>
  <confidence>Idea</confidence>
  <formalization language="(none)">
    <participant identifier="control" type="UIElement"/>
    <participant identifier="notecard" type="TextDocument"/>
    <participant identifier="reference" type="URI"/>
  </formalization>
</pattern>