<?xml-stylesheet href="../etc/plml_bo-2.2.css" type="text/css"?>
<pattern patternID="3" xsi:noNamespaceSchemaLocation="../xsd/plml-bo-2.2.xsd" xmlns:xsi="http://www.w3.org/2001/XMLSchema-instance">
  <name>Parametrized Avatar Appearance</name>
  <name-DE>Parametrisierte Avatar-Gestalt</name-DE>
  <problem>TODO engl. description</problem>
  <problem-DE>
    Die Zuordnung eines Avatars zu vorherigen Wortbeiträgen oder Aktionen im virtuellen Lehrraum ist 
    nötig.       
  </problem-DE>
  <solution>TODO engl. description</solution>
  <solution-DE>
    Dies lässt sich durch eine individuelle Gestaltung der Avatare lösen, z. B. mittels Kleidung,
    Frisuren etc., die mittels individuell einstellbarer Parameter vorgehalten wird. Einfache Varianten
    beschränken sich auf Parameter wie Größe/Breite, Farbwahl u. ä. 
  </solution-DE>
  <confidence>Idea</confidence>
  <formalization language="(none)">
    <participant identifier="avatar" type="Avatar"/>
    <participant identifier="parameter" type="KeyValuePairList"/>
    <participant identifier="color" type="KeyValuePair"/>
    <participant identifier="geometricParameter" type="KeyValuePair"/>
  </formalization>
</pattern>